{
  "group_key": "IGP/OSPF",
  "group_title_zh": "OSPF",
  "group_title_en": "OSPF",
  "overview_zh": "本协议目前覆盖的内容集中在邻居关系的建立与验证上:hello 报文如何发现邻居、四项参数为什么必须同时匹配、邻居状态如何从 Down 推进到 Full、广播网络上 DR 与 BDR 如何选举,以及如何用命令验证结果。面试中这一块问得最细,因为它同时考概念、顺序和排查思路。",
  "covered_chapters": [
    {
      "pdf_id": "ospf-neighbor-adjacency-69619352",
      "title_zh": "OSPF 邻居邻接关系",
      "key_points_zh": [
        "hello 报文与邻居发现,四项必须匹配的参数",
        "邻居状态 Down、Init、2-Way、Full 及各自触发条件",
        "广播网络上 DR 与 BDR 的选举判定顺序",
        "用 show ip ospf neighbor 验证邻居状态与接口"
      ]
    }
  ],
  "knowledge_map": {
    "mermaid": "flowchart TD\n    A[hello packets 发现邻居] --> B{四项参数是否全部匹配?}\n    B -- 否 --> X[不成为邻居]\n    B -- 是 --> C[Down]\n    C -->|收到 hello| D[Init]\n    D -->|看到自己的 router ID| E[2-Way]\n    E -->|database exchange 完成| F[Full]\n    E --> G{是否广播网络?}\n    G -- 是 --> H[选举 DR 与 BDR]\n    H --> I[其余路由器只与 DR/BDR 完全邻接]\n    F --> V[show ip ospf neighbor 验证]",
    "reading_order_zh": [
      "先看 hello 报文与四项匹配参数 —— 这是所有后续内容的前提,邻居都建不起来就谈不上状态推进。",
      "再看邻居状态机 Down 到 Full —— 重点记每一步的触发条件,而不是状态名字。",
      "然后看 DR 与 BDR 选举 —— 它只在广播网络上发生,判定顺序和特例要一起记。",
      "最后看验证命令 —— 把 show ip ospf neighbor 的 State 列和前面的状态机对应起来,形成闭环。"
    ]
  },
  "must_master": [
    {
      "point_zh": "hello interval、dead interval、area ID、子网掩码四项必须同时匹配,两台路由器才会成为邻居。",
      "why_zh": "这是邻居关系的准入条件,也是排查邻居建不起来时的第一张检查清单。只记住一项就会漏掉另外三个原因。",
      "grounding": [
        {"pdf_id": "ospf-neighbor-adjacency-69619352", "page": 1,
         "quote": "Two routers become neighbors only when the hello interval, the dead interval, the area ID and the subnet mask all match."}
      ]
    },
    {
      "point_zh": "hello 报文在广播网段上发往组播地址 224.0.0.5,每 10 秒一次;dead interval 默认 40 秒,是其四倍。",
      "why_zh": "这两个数值几乎是必问的送分题,而且 40 与 10 的四倍关系还会被继续追问为什么这样设计。",
      "grounding": [
        {"pdf_id": "ospf-neighbor-adjacency-69619352", "page": 1,
         "quote": "The hello packet is sent to multicast address 224.0.0.5 every 10 seconds on a broadcast network segment."},
        {"pdf_id": "ospf-neighbor-adjacency-69619352", "page": 1,
         "quote": "The dead interval is 40 seconds by default, which is four times the hello interval."}
      ]
    },
    {
      "point_zh": "进入 2-Way 的条件是在收到的 hello 报文里看到自己的 router ID,而不是又收到一个 hello。",
      "why_zh": "这是区分背过与真懂的分水岭。答成又收到一个 hello,面试官立刻知道候选人没理解双向确认的含义。",
      "grounding": [
        {"pdf_id": "ospf-neighbor-adjacency-69619352", "page": 2,
         "quote": "Once the router sees its own router ID in the received hello packet, the neighbor moves to the 2-Way state."}
      ]
    },
    {
      "point_zh": "DR 选举先比 OSPF priority 且最高者胜,priority 相同再比 router ID 且最大者胜,priority 为 0 者永不当选。",
      "why_zh": "顺序、方向、特例三点缺一不可,是最容易被连环追问的地方。",
      "grounding": [
        {"pdf_id": "ospf-neighbor-adjacency-69619352", "page": 3,
         "quote": "The router with the highest OSPF priority becomes the designated router."},
        {"pdf_id": "ospf-neighbor-adjacency-69619352", "page": 3,
         "quote": "A priority of 0 means the router will never become the designated router."}
      ]
    },
    {
      "point_zh": "选出 DR 和 BDR 后,其余路由器只与 DR 和 BDR 建立完全邻接,彼此之间不建立。",
      "why_zh": "这一条直接回答了为什么要选举,是把知识点串成体系的关键;答不出来说明只背了规则没理解目的。",
      "grounding": [
        {"pdf_id": "ospf-neighbor-adjacency-69619352", "page": 3,
         "quote": "All other routers form a full adjacency only with the DR and the BDR."}
      ]
    }
  ],
  "fundamentals": [
    {
      "id": "f1",
      "difficulty": 2,
      "tags_zh": ["邻居建立", "高频"],
      "q_zh": "请完整讲一遍 OSPF 邻居关系是怎么从零建立到完全邻接的。",
      "q_en": "Walk me through how an OSPF neighbor relationship is established from scratch to full adjacency.",
      "answer_template_zh": {
        "opening": "一句话说:先靠 hello 报文互相发现,再核对四项参数确认是邻居,然后状态从 Down 依次推进到 Init、2-Way,数据库交换完成后到 Full。",
        "body": [
          {"label": "发现阶段",
           "content": "路由器在链路上互发 hello 报文来发现邻居。在广播网段上,hello 报文发往组播地址 224.0.0.5,每 10 秒一次。"},
          {"label": "准入条件",
           "content": "收到 hello 还不够,必须 hello interval、dead interval、area ID 和子网掩码四项全部匹配,才会成为邻居;其中 dead interval 默认 40 秒,是 hello interval 的四倍。"},
          {"label": "状态推进",
           "content": "最初是 Down,表示还没收到过 hello;收到 hello 后进入 Init;在收到的 hello 里看到自己的 router ID 后进入 2-Way;数据库交换完成后到达 Full。"},
          {"label": "验证方法",
           "content": "用 show ip ospf neighbor 查看,输出里的 State 列就是上面的状态,Interface 列说明邻居在哪条链路上。"}
        ],
        "closing": "所以判断邻接是否真的建好,标准是 State 到 Full,而不是能看到邻居条目。"
      },
      "answer_template_en": {
        "opening": "In short: routers discover each other with hello packets, check four parameters to accept each other as neighbors, then move from Down through Init and 2-Way, and reach Full after the database exchange.",
        "body": [
          {"label": "Discovery",
           "content": "OSPF routers use hello packets to discover neighbors on a link. On a broadcast network segment the hello packet is sent to multicast address 224.0.0.5 every 10 seconds."},
          {"label": "Acceptance conditions",
           "content": "Two routers become neighbors only when the hello interval, the dead interval, the area ID and the subnet mask all match. The dead interval is 40 seconds by default, four times the hello interval."},
          {"label": "State progression",
           "content": "The first state is Down. Receiving a hello packet moves the neighbor to Init. Seeing its own router ID in the received hello packet moves it to 2-Way. After the database exchange finishes it reaches Full."},
          {"label": "Verification",
           "content": "Use the show ip ospf neighbor command; the State column shows the state and the Interface column shows where the neighbor was found."}
        ],
        "closing": "So the real criterion for a working adjacency is reaching the Full state, not merely seeing a neighbor entry."
      },
      "scoring_points_zh": [
        "说出 hello 报文与组播地址 224.0.0.5、10 秒周期",
        "四项匹配参数完整说出且强调必须全部匹配",
        "四个状态顺序正确,并说出各自触发条件",
        "2-Way 的条件说成看到自己的 router ID",
        "提到用 show ip ospf neighbor 验证"
      ],
      "scoring_points_en": [
        "Mentions hello packets, multicast address 224.0.0.5 and the 10 second interval",
        "Lists all four matching parameters and stresses that all must match",
        "Gives the four states in the right order with their triggers",
        "States the 2-Way trigger as seeing its own router ID",
        "Mentions verifying with show ip ospf neighbor"
      ],
      "grounding": [
        {"pdf_id": "ospf-neighbor-adjacency-69619352", "page": 1,
         "quote": "OSPF routers use hello packets to discover neighbors on a link."},
        {"pdf_id": "ospf-neighbor-adjacency-69619352", "page": 2,
         "quote": "An OSPF neighbor moves through several states before the adjacency is complete."}
      ],
      "extension_zh": "实际排障时,这套流程通常配合抓包一起看:如果一端在发、另一端完全收不到,问题往往在二层而不是 OSPF 本身。这一点课程原文没有涉及,属于工程经验。",
      "extension_en": "In real troubleshooting this flow is usually combined with packet capture: if one side sends but the other receives nothing, the problem is often at layer 2 rather than in OSPF itself. This is field experience, not part of the course material."
    },
    {
      "id": "f2",
      "difficulty": 1,
      "tags_zh": ["参数", "送分题"],
      "q_zh": "两台路由器要成为 OSPF 邻居,必须匹配哪几项参数?漏掉一项会怎样?",
      "q_en": "Which parameters must match for two routers to become OSPF neighbors, and what happens if one does not match?",
      "answer_template_zh": {
        "opening": "四项:hello interval、dead interval、area ID 和子网掩码,必须全部匹配。",
        "body": [
          {"label": "分类记忆",
           "content": "这四项可以分两类记:时间参数是 hello interval 和 dead interval,身份与网段参数是 area ID 和子网掩码。"},
          {"label": "逻辑关系",
           "content": "原文的表述是 only when ... all match,是四项同时成立的关系,任意一项不一致就不会成为邻居。"}
        ],
        "closing": "所以排查邻居建不起来时,这四项要逐项核对,不能只看其中一项。"
      },
      "answer_template_en": {
        "opening": "Four parameters: the hello interval, the dead interval, the area ID and the subnet mask, and all of them must match.",
        "body": [
          {"label": "How to remember",
           "content": "Two of them are timers, the hello interval and the dead interval; the other two identify the area and the segment, the area ID and the subnet mask."},
          {"label": "Logical relation",
           "content": "The wording is only when all match, so it is a conjunction: if any single one differs, the routers do not become neighbors."}
        ],
        "closing": "When an adjacency does not come up, check all four rather than just one of them."
      },
      "scoring_points_zh": [
        "四项一个不漏",
        "明确说明必须全部匹配",
        "能指出任意一项不一致就不成为邻居"
      ],
      "scoring_points_en": [
        "Lists all four parameters",
        "States explicitly that all must match",
        "Notes that a single mismatch prevents the adjacency"
      ],
      "grounding": [
        {"pdf_id": "ospf-neighbor-adjacency-69619352", "page": 1,
         "quote": "Two routers become neighbors only when the hello interval, the dead interval, the area ID and the subnet mask all match."}
      ]
    },
    {
      "id": "f3",
      "difficulty": 2,
      "tags_zh": ["状态机"],
      "q_zh": "Init 和 2-Way 分别在什么条件下进入?两者的本质区别是什么?",
      "q_en": "Under what conditions does a neighbor enter Init and 2-Way, and what is the essential difference?",
      "answer_template_zh": {
        "opening": "收到 hello 报文进入 Init;在收到的 hello 报文里看到自己的 router ID 才进入 2-Way。区别在于单向与双向。",
        "body": [
          {"label": "Init 的含义",
           "content": "Init 只说明本端收到了对方的 hello,并不说明对方收到了本端的 hello,所以只能证明单向。"},
          {"label": "2-Way 的含义",
           "content": "对方发来的 hello 里出现了本端的 router ID,说明对方此前收到过本端的 hello,双向可达因此得到确认,这正是 2-Way 这个名字的来源。"}
        ],
        "closing": "所以状态停在 Init,通常意味着有一个方向的 hello 没有被对端收到。"
      },
      "answer_template_en": {